{
  "schemaVersion": 1,
  "authority": {
    "definitionNamesAndCounts": "Vertical Slice Production Spec v1.1 sections 15-21",
    "starterDeck": "Vertical Slice Production Spec v1.1 section 22",
    "gameplayValues": "Economy Balance Progression Bible v0.8; absent per-card values remain explicitly unauthored",
    "prefabPolicy": "C++ graybox classes are temporary source-resolvable representations"
  },
  "expectedCounts": {
    "Synara": 15,
    "Forgeweave": 15,
    "EdenCircuit": 15,
    "Universal": 17,
    "Fusion": 1,
    "Special": 1,
    "total": 64,
    "starterInstances": 60
  },
  "definitions": [
    {
      "id": "synara.adaptive_habitat",
      "displayName": "Adaptive Habitat",
      "faction": "Synara",
      "cardType": "Residential",
      "rarity": "Common",
      "placeable": true,
      "footprint": [
        2,
        2
      ],
      "footprintAuthority": "Content Production Bible v0.6",
      "worldPrefab": "/Script/DominionGameplay.DAGrayboxBuildingActor",
      "randomCacheEligible": false,
      "valueAuthority": "Economy Balance Progression Bible v0.8 sections 24 and 51",
      "authoredValues": [
        "deploymentCapital",
        "craftCapital",
        "maintenanceCapitalPerCycle"
      ],
      "deploymentCapital": 8,
      "craftCapital": 4,
      "maintenanceCapitalPerCycle": 0.04,
      "tags": [],
      "upgradeBranchIds": []
    },
    {
      "id": "synara.civic_autonomy_pods",
      "displayName": "Civic Autonomy Pods",
      "faction": "Synara",
      "cardType": "Residential",
      "rarity": "Common",
      "placeable": true,
      "footprint": [
        1,
        2
      ],
      "footprintAuthority": "Content Production Bible v0.6",
      "worldPrefab": "/Script/DominionGameplay.DAGrayboxBuildingActor",
      "randomCacheEligible": false,
      "authoredValues": [],
      "tags": [],
      "upgradeBranchIds": []
    },
    {
      "id": "synara.cognitive_operations_tower",
      "displayName": "Cognitive Operations Tower",
      "faction": "Synara",
      "cardType": "Office",
      "rarity": "Common",
      "placeable": true,
      "footprint": [
        2,
        2
      ],
      "footprintAuthority": "Content Production Bible v0.6",
      "worldPrefab": "/Script/DominionGameplay.DAGrayboxBuildingActor",
      "randomCacheEligible": false,
      "authoredValues": [],
      "tags": [],
      "upgradeBranchIds": []
    },
    {
      "id": "synara.predictive_bureau",
      "displayName": "Predictive Bureau",
      "faction": "Synara",
      "cardType": "Office",
      "rarity": "Common",
      "placeable": true,
      "footprint": [
        2,
        2
      ],
      "footprintAuthority": "Content Production Bible v0.6",
      "worldPrefab": "/Script/DominionGameplay.DAGrayboxBuildingActor",
      "randomCacheEligible": false,
      "authoredValues": [],
      "tags": [],
      "upgradeBranchIds": []
    },
    {
      "id": "synara.autonomous_exchange",
      "displayName": "Autonomous Exchange",
      "faction": "Synara",
      "cardType": "Retail",
      "rarity": "Common",
      "placeable": true,
      "footprint": [
        1,
        2
      ],
      "footprintAuthority": "Content Production Bible v0.6",
      "worldPrefab": "/Script/DominionGameplay.DAGrayboxBuildingActor",
      "randomCacheEligible": false,
      "valueAuthority": "Economy Balance Progression Bible v0.8 section 47",
      "authoredValues": [
        "synaraDependencyPerCycle"
      ],
      "synaraDependencyPerCycle": 0.1,
      "tags": [],
      "upgradeBranchIds": []
    },
    {
      "id": "synara.algorithmic_market",
      "displayName": "Algorithmic Market",
      "faction": "Synara",
      "cardType": "Retail",
      "rarity": "Common",
      "placeable": true,
      "footprint": [
        2,
        2
      ],
      "footprintAuthority": "Content Production Bible v0.6",
      "worldPrefab": "/Script/DominionGameplay.DAGrayboxBuildingActor",
      "randomCacheEligible": false,
      "authoredValues": [],
      "tags": [],
      "upgradeBranchIds": []
    },
    {
      "id": "synara.synthetic_fabrication_node",
      "displayName": "Synthetic Fabrication Node",
      "faction": "Synara",
      "cardType": "Industrial",
      "rarity": "Common",
      "placeable": true,
      "footprint": [
        2,
        3
      ],
      "footprintAuthority": "Content Production Bible v0.6",
      "worldPrefab": "/Script/DominionGameplay.DAGrayboxBuildingActor",
      "randomCacheEligible": false,
      "authoredValues": [],
      "tags": [],
      "upgradeBranchIds": []
    },
    {
      "id": "synara.swarm_foundry",
      "displayName": "Swarm Foundry",
      "faction": "Synara",
      "cardType": "Industrial",
      "rarity": "Common",
      "placeable": true,
      "footprint": [
        3,
        3
      ],
      "footprintAuthority": "Content Production Bible v0.6",
      "worldPrefab": "/Script/DominionGameplay.DAGrayboxBuildingActor",
      "randomCacheEligible": false,
      "authoredValues": [],
      "tags": [],
      "upgradeBranchIds": []
    },
    {
      "id": "synara.neural_relay",
      "displayName": "Neural Relay",
      "faction": "Synara",
      "cardType": "Infrastructure",
      "rarity": "Common",
      "placeable": true,
      "footprint": [
        1,
        1
      ],
      "footprintAuthority": "Content Production Bible v0.6",
      "worldPrefab": "/Script/DominionGameplay.DAGrayboxBuildingActor",
      "randomCacheEligible": false,
      "authoredValues": [],
      "tags": [],
      "upgradeBranchIds": []
    },
    {
      "id": "synara.orchestration_hub",
      "displayName": "Orchestration Hub",
      "faction": "Synara",
      "cardType": "Infrastructure",
      "rarity": "Common",
      "placeable": true,
      "footprint": [
        1,
        1
      ],
      "footprintAuthority": "Content Production Bible v0.6",
      "worldPrefab": "/Script/DominionGameplay.DAGrayboxBuildingActor",
      "randomCacheEligible": false,
      "authoredValues": [],
      "tags": [],
      "upgradeBranchIds": []
    },
    {
      "id": "synara.guardian_drone_cohort",
      "displayName": "Guardian Drone Cohort",
      "faction": "Synara",
      "cardType": "Unit",
      "rarity": "Common",
      "placeable": false,
      "footprint": [
        0,
        0
      ],
      "footprintAuthority": "graybox placeholder; not balance authority",
      "worldPrefab": "/Script/DominionGameplay.DAGrayboxUnitActor",
      "randomCacheEligible": false,
      "valueAuthority": "Economy Balance Progression Bible v0.8 section 52",
      "authoredValues": [
        "craftCapital",
        "craftInsight",
        "craftProductionThroughput",
        "requiredCraftingFacilityId",
        "constructionCycles"
      ],
      "craftCapital": 8,
      "craftInsight": 2,
      "craftProductionThroughput": 5,
      "requiredCraftingFacilityId": "synara.synthetic_fabrication_node",
      "constructionCycles": 2,
      "tags": [],
      "upgradeBranchIds": []
    },
    {
      "id": "synara.audit_sentinel",
      "displayName": "Audit Sentinel",
      "faction": "Synara",
      "cardType": "Unit",
      "rarity": "Common",
      "placeable": false,
      "footprint": [
        0,
        0
      ],
      "footprintAuthority": "graybox placeholder; not balance authority",
      "worldPrefab": "/Script/DominionGameplay.DAGrayboxUnitActor",
      "randomCacheEligible": false,
      "authoredValues": [],
      "tags": [],
      "upgradeBranchIds": []
    },
    {
      "id": "synara.agency_forum",
      "displayName": "Agency Forum",
      "faction": "Synara",
      "cardType": "Civic",
      "rarity": "Common",
      "placeable": true,
      "footprint": [
        2,
        2
      ],
      "footprintAuthority": "Content Production Bible v0.6",
      "worldPrefab": "/Script/DominionGameplay.DAGrayboxBuildingActor",
      "randomCacheEligible": false,
      "valueAuthority": "Economy Balance Progression Bible v0.8 section 47",
      "authoredValues": [
        "synaraDependencyPerCycle"
      ],
      "synaraDependencyPerCycle": -0.2,
      "tags": [],
      "upgradeBranchIds": []
    },
    {
      "id": "synara.archon_mira_vey",
      "displayName": "Archon Mira Vey",
      "faction": "Synara",
      "cardType": "Leader",
      "rarity": "Leader",
      "placeable": false,
      "footprint": [
        0,
        0
      ],
      "footprintAuthority": "graybox placeholder; not balance authority",
      "worldPrefab": "/Script/DominionGameplay.DAGrayboxLeaderActor",
      "randomCacheEligible": false,
      "authoredValues": [],
      "tags": [],
      "upgradeBranchIds": []
    },
    {
      "id": "synara.the_thinking_spire",
      "displayName": "The Thinking Spire",
      "faction": "Synara",
      "cardType": "Wonder",
      "rarity": "Wonder",
      "placeable": true,
      "footprint": [
        1,
        1
      ],
      "footprintAuthority": "graybox placeholder; not balance authority",
      "worldPrefab": "/Script/DominionGameplay.DAGrayboxWonderActor",
      "randomCacheEligible": false,
      "valueAuthority": "Economy Balance Progression Bible v0.8 sections 47 and 136",
      "authoredValues": [
        "deploymentCapital",
        "deploymentInsight",
        "deploymentInfluence",
        "synaraDependencyPerCycle",
        "constructionCycles"
      ],
      "deploymentCapital": 220,
      "deploymentInsight": 30,
      "deploymentInfluence": 25,
      "synaraDependencyPerCycle": 0.35,
      "constructionCycles": 12,
      "tags": [],
      "upgradeBranchIds": []
    },
    {
      "id": "forgeweave.worker_arcology",
      "displayName": "Worker Arcology",
      "faction": "Forgeweave",
      "cardType": "Residential",
      "rarity": "Common",
      "placeable": true,
      "footprint": [
        2,
        2
      ],
      "footprintAuthority": "Content Production Bible v0.6",
      "worldPrefab": "/Script/DominionGameplay.DAGrayboxBuildingActor",